[
  {
    "id": "dinh-doc-lap",
    "name": "Dinh Độc Lập",
    "category": "historical-site",
    "description": null,
    "address": "106 Nguyễn Du, phường Bến Thành, TP. Hồ Chí Minh",
    "latitude": 10.777108,
    "longitude": 106.695441,
    "coordinateSourceUrl": "https://vi.wikipedia.org/wiki/Dinh_%C4%90%E1%BB%99c_L%E1%BA%ADp",
    "image": "./assets/images/independence-palace.jpg",
    "imageAlt": "Mặt tiền và tòa nhà chính của Dinh Độc Lập",
    "imageCreator": "Matti Blume",
    "imageSource": "https://commons.wikimedia.org/wiki/File:Independence_Palace,_Ho_Chi_Minh_(LRM_20230823_093633).jpg",
    "imageLicense": "CC BY-SA 4.0",
    "imageLicenseUrl": "https://creativecommons.org/licenses/by-sa/4.0/",
    "sourceUrl": "https://dinhdoclap.gov.vn/lien-he/",
    "lastVerified": "2026-10-25",
    "openingHours": "Thứ 2 đến Chủ nhật, 07:00–18:00 (trừ trường hợp có thông báo riêng).",
    "ticketInfo": "Vé tham quan toàn bộ di tích: người lớn 80.000 ₫; sinh viên và người cao tuổi 40.000 ₫; trẻ em 6–17 tuổi 20.000 ₫. Có loại vé tham quan từng phần và dịch vụ xe điện; xác nhận giá trước khi mua.",
    "visitorInfoVerified": true,
    "hasPanorama": false,
    "panoramaSource": null,
    "panoramaLicense": null,
    "tags": ["lịch sử", "di tích"],
    "featured": true,
    "verificationStatus": "partially-verified",
    "verificationNotes": "Tên, địa chỉ, giờ mở cửa và giá vé được đối chiếu trên trang liên hệ chính thức ngày 25/10/2026; tọa độ lấy từ tọa độ bài viết Wikipedia tiếng Việt. Ảnh mặt tiền do Matti Blume chụp, cấp phép CC BY-SA 4.0. Có nhiều loại vé; vui lòng xem thông tin hiện hành trên trang chính thức."
  },
  {
    "id": "cho-ben-thanh",
    "name": "Chợ Bến Thành",
    "category": "market",
    "description": null,
    "address": "Quảng trường Quách Thị Trang, phường Bến Thành, TP. Hồ Chí Minh",
    "latitude": 10.77252069,
    "longitude": 106.69801918,
    "coordinateSourceUrl": "https://vi.wikipedia.org/wiki/Ch%E1%BB%A3_B%E1%BA%BFn_Th%C3%A0nh",
    "image": "./assets/images/ben-thanh-market.jpg",
    "imageAlt": "Mặt tiền Chợ Bến Thành tại Thành phố Hồ Chí Minh",
    "imageCreator": "Diego Delso",
    "imageSource": "https://commons.wikimedia.org/wiki/File:Ben_Thanh,_Ciudad_Ho_Chi_Minh,_Vietnam,_2013-08-14,_DD_01.JPG",
    "imageLicense": "CC BY-SA 3.0",
    "imageLicenseUrl": "https://creativecommons.org/licenses/by-sa/3.0/",
    "sourceUrl": "https://en.wikipedia.org/wiki/B%E1%BA%BFn_Th%C3%A0nh_Market",
    "lastVerified": "2026-10-24",
    "openingHours": "Giờ tham khảo: khoảng 06:00–18:00; giờ hoạt động từng sạp có thể khác. Nên hỏi ban quản lý trước khi ghé.",
    "ticketInfo": "Không có vé vào cổng chợ; giá hàng hóa do từng sạp niêm yết.",
    "visitorInfoVerified": false,
    "hasPanorama": false,
    "panoramaSource": null,
    "panoramaLicense": null,
    "tags": [],
    "featured": true,
    "verificationStatus": "partially-verified",
    "verificationNotes": "Địa điểm được bài viết Wikipedia tiếng Anh ghi tại Quảng trường Quách Thị Trang, phường Bến Thành; tọa độ lấy từ bài viết Wikipedia tiếng Việt. Ảnh do Diego Delso chụp và cấp phép CC BY-SA 3.0. Giờ hoạt động và thông tin tham quan chưa được xác nhận."
  },
  {
    "id": "buu-dien-trung-tam-sai-gon",
    "name": "Bưu điện Trung tâm Sài Gòn",
    "category": "architecture",
    "description": null,
    "address": "Số 2, quảng trường Công xã Paris, phường Sài Gòn, TP. Hồ Chí Minh",
    "latitude": 10.779884,
    "longitude": 106.699943,
    "coordinateSourceUrl": "https://vi.wikipedia.org/wiki/B%C6%B0u_%C4%91i%E1%BB%87n_S%C3%A0i_G%C3%B2n",
    "image": "./assets/images/saigon-central-post-office.jpg",
    "imageAlt": "Đồng hồ và mặt tiền Bưu điện Trung tâm Sài Gòn",
    "imageCreator": "Prenn",
    "imageSource": "https://commons.wikimedia.org/wiki/File:Clock_and_exterior_of_Saigon_Central_Post_Office.JPG",
    "imageLicense": "CC BY-SA 3.0",
    "imageLicenseUrl": "https://creativecommons.org/licenses/by-sa/3.0/",
    "sourceUrl": "https://en.wikipedia.org/wiki/Saigon_Central_Post_Office",
    "lastVerified": "2026-10-24",
    "openingHours": "Giờ tham khảo: khoảng 08:00–17:00; thời gian phục vụ bưu chính có thể khác.",
    "ticketInfo": "Không thu vé tham quan khu vực chung; dịch vụ bưu chính và mua hàng tính phí riêng.",
    "visitorInfoVerified": false,
    "hasPanorama": false,
    "panoramaSource": null,
    "panoramaLicense": null,
    "tags": [],
    "featured": true,
    "verificationStatus": "partially-verified",
    "verificationNotes": "Địa chỉ số 2, quảng trường Công xã Paris được đối chiếu với bài viết Wikipedia tiếng Anh; tọa độ lấy từ tọa độ bài viết Wikipedia tiếng Việt. Ảnh đồng hồ và mặt tiền do Prenn chụp, cấp phép CC BY-SA 3.0. Giờ hoạt động và thông tin tham quan chưa được xác nhận."
  },
  {
    "id": "bao-tang-chung-tich-chien-tranh",
    "name": "Bảo tàng Chứng tích Chiến tranh",
    "category": "museum",
    "description": null,
    "address": "28 Võ Văn Tần, phường Xuân Hòa, TP. Hồ Chí Minh",
    "latitude": 10.779475,
    "longitude": 106.692132,
    "coordinateSourceUrl": "https://en.wikipedia.org/wiki/War_Remnants_Museum",
    "image": "./assets/images/war-remnants-museum.jpg",
    "imageAlt": "Tòa nhà chính của Bảo tàng Chứng tích Chiến tranh",
    "imageCreator": "Smuconlaw.",
    "imageSource": "https://commons.wikimedia.org/wiki/File:Main_building_of_the_War_Remnants_Museum,_Ho_Chi_Minh_City,_Vietnam_-_20120810-01.jpg",
    "imageLicense": "CC BY-SA 3.0",
    "imageLicenseUrl": "https://creativecommons.org/licenses/by-sa/3.0/",
    "sourceUrl": "https://en.wikipedia.org/wiki/War_Remnants_Museum",
    "lastVerified": "2026-10-24",
    "openingHours": "Giờ tham khảo: khoảng 07:30–17:30 hằng ngày; xác nhận lịch hiện hành với bảo tàng trước khi ghé.",
    "ticketInfo": "Giá vé tham khảo: khoảng 40.000 ₫/người; giá ưu đãi và mức thu hiện hành cần xác nhận với bảo tàng.",
    "visitorInfoVerified": false,
    "hasPanorama": false,
    "panoramaSource": null,
    "panoramaLicense": null,
    "tags": [],
    "featured": true,
    "verificationStatus": "partially-verified",
    "verificationNotes": "Địa chỉ và tọa độ 10.779475, 106.692132 được đối chiếu với bài viết Wikipedia tiếng Anh. Ảnh tòa nhà chính do Smuconlaw. chụp, cấp phép CC BY-SA 3.0. Giờ hoạt động và thông tin tham quan cần kiểm tra trước khi ghé."
  },
  {
    "id": "nha-tho-duc-ba-sai-gon",
    "name": "Nhà thờ Đức Bà Sài Gòn",
    "category": "architecture",
    "description": null,
    "address": "Số 1 Công xã Paris, phường Sài Gòn, TP. Hồ Chí Minh",
    "latitude": 10.779722,
    "longitude": 106.699167,
    "coordinateSourceUrl": "https://vi.wikipedia.org/wiki/Nh%C3%A0_th%E1%BB%9D_ch%C3%ADnh_t%C3%B2a_%C4%90%E1%BB%A9c_B%C3%A0_S%C3%A0i_G%C3%B2n",
    "image": "./assets/images/saigon-notre-dame-cathedral.jpg",
    "imageAlt": "Nhà thờ Chính tòa Đức Bà Sài Gòn nhìn từ bên ngoài",
    "imageCreator": "P. Hughes",
    "imageSource": "https://commons.wikimedia.org/wiki/File:Ho_Chi_MInh_CIty_-_Notre-Dame_Cathedral_Basilica_of_Saigon.jpg",
    "imageLicense": "CC BY 4.0",
    "imageLicenseUrl": "https://creativecommons.org/licenses/by/4.0/",
    "sourceUrl": "https://en.wikipedia.org/wiki/Notre-Dame_Cathedral_Basilica_of_Saigon",
    "lastVerified": "2026-10-24",
    "openingHours": "Có thể tham quan khu vực bên ngoài; nhà thờ đang trùng tu và giờ vào bên trong chưa được xác nhận.",
    "ticketInfo": "Không thu vé tại khu vực quảng trường bên ngoài; việc vào bên trong phụ thuộc lịch hoạt động và tình trạng trùng tu.",
    "visitorInfoVerified": false,
    "hasPanorama": false,
    "panoramaSource": null,
    "panoramaLicense": null,
    "tags": [],
    "featured": true,
    "verificationStatus": "partially-verified",
    "verificationNotes": "Vị trí tại quảng trường Công xã Paris, phường Sài Gòn và số nhà 1 Công xã Paris được đối chiếu với thông tin địa điểm của nhà thờ; tọa độ lấy từ bài viết Wikipedia tiếng Việt. Ảnh do P. Hughes chụp, cấp phép CC BY 4.0. Tình trạng mở cửa và khả năng tham quan cần kiểm tra trước khi ghé."
  },
  {
    "id": "pho-di-bo-nguyen-hue",
    "name": "Phố đi bộ Nguyễn Huệ",
    "category": "public-space",
    "description": null,
    "address": "Đại lộ Nguyễn Huệ, từ đường Lê Thánh Tôn đến Bến Bạch Đằng, TP. Hồ Chí Minh",
    "latitude": 10.774112,
    "longitude": 106.703619,
    "coordinateSourceUrl": "https://en.wikipedia.org/wiki/Nguy%E1%BB%85n_Hu%E1%BB%87_Boulevard",
    "image": "./assets/images/nguyen-hue-walking-street.jpg",
    "imageAlt": "Đại lộ đi bộ Nguyễn Huệ tại Thành phố Hồ Chí Minh",
    "imageCreator": "Terrazzo",
    "imageSource": "https://commons.wikimedia.org/wiki/File:Nguyen_Hue_Pedestrian_Boulevard_(37021598281).jpg",
    "imageLicense": "CC BY 2.0",
    "imageLicenseUrl": "https://creativecommons.org/licenses/by/2.0/",
    "sourceUrl": "https://en.wikipedia.org/wiki/Nguy%E1%BB%85n_Hu%E1%BB%87_Boulevard",
    "lastVerified": "2026-10-24",
    "openingHours": "Không có giờ đóng cửa cố định cho không gian phố đi bộ; sự kiện và thời điểm hạn chế giao thông có thể thay đổi.",
    "ticketInfo": "Miễn phí tham quan không gian công cộng; dịch vụ và sự kiện riêng có thể thu phí.",
    "visitorInfoVerified": false,
    "hasPanorama": false,
    "panoramaSource": null,
    "panoramaLicense": null,
    "tags": [],
    "featured": true,
    "verificationStatus": "partially-verified",
    "verificationNotes": "Đại lộ Nguyễn Huệ kéo dài từ đường Lê Thánh Tôn đến khu vực Bến Bạch Đằng; điểm ghim 10.774112, 106.703619 là tọa độ đại diện theo bài viết Wikipedia tiếng Anh, không phải địa chỉ của toàn tuyến phố. Ảnh do Terrazzo chụp, cấp phép CC BY 2.0."
  },
  {
    "id": "nha-hat-thanh-pho",
    "name": "Nhà hát Thành phố",
    "category": "performing-arts",
    "description": null,
    "address": "Số 7, quảng trường Lam Sơn, phường Sài Gòn, TP. Hồ Chí Minh",
    "latitude": 10.7767525,
    "longitude": 106.7032824,